序号,企业名称,国家,省份,城市,经度,纬度,备注
615,山东旷为信息科技有限公司,中国,山东,济南,,,未找到坐标
616,山东华商亿源制冷空调工程有限公司,中国,山东,济南,,,未找到坐标
617,山东百舜信息技术有限公司,中国,山东,济南,,,未找到坐标
618,山东博通节能科技有限公司,中国,山东,济南,,,未找到坐标
619,泉脉农业科技有限公司,中国,山东,济南,116.807305,36.507504,
620,山东汇创信息技术有限公司,中国,山东,济南,,,未找到坐标
621,山东顺能网络科技有限公司,中国,山东,济南,,,未找到坐标
622,济南东和信息技术有限公司,中国,山东,济南,,,未找到坐标
623,山东泓科信息技术有限公司,中国,山东,济南,117.127679,36.674153,
624,济南创泽生物医药科技有限公司,中国,山东,济南,,,未找到坐标
625,山东瑶安电子科技发展有限公司,中国,山东,济南,117.152681,36.660583,
626,济南沃隆软件技术有限公司,中国,山东,济南,,,未找到坐标
627,山东文保文物修复技术有限公司,中国,山东,济南,117.222338,36.657031,
628,济南德尔姆仪器有限公司,中国,山东,济南,117.300782,36.702219,
629,山东丞辉信息科技发展有限公司,中国,山东,济南,,,未找到坐标
630,山东友大软件科技有限公司,中国,山东,济南,,,未找到坐标
631,山东经纬信息集团有限公司,中国,山东,济南,,,未找到坐标
632,山东军地信息技术集团有限公司,中国,山东,济南,,,未找到坐标
633,赛克赛斯生物科技股份有限公司,中国,山东,济南,117.140503,36.683940,
634,迈德（山东）科技股份有限公司,中国,山东,济南,,,未找到坐标
635,山东天泰啤酒设备有限公司,中国,山东,济南,,,未找到坐标
636,山东路科公路信息咨询有限公司,中国,山东,济南,,,未找到坐标
637,山东水发生命科学研究有限公司,中国,山东,济南,117.326650,36.703689,
638,山东浪潮科学研究院有限公司,中国,山东,济南,117.130009,36.663726,
639,山东耀智信息科技有限公司,中国,山东,济南,,,未找到坐标
640,山东小鸭冷链有限公司,中国,山东,济南,,,未找到坐标
641,山东煜德电子技术有限公司,中国,山东,济南,117.129020,36.673805,
642,山东万腾智能科技有限公司,中国,山东,济南,,,未找到坐标
643,山东智慧照明科技有限公司,中国,山东,济南,,,未找到坐标
644,济南祥控自动化设备有限公司,中国,山东,济南,,,未找到坐标
645,济南行者网络科技有限公司,中国,山东,济南,,,未找到坐标
646,山东圣瑞信息技术有限公司,中国,山东,济南,,,未找到坐标
647,山东万腾数字科技有限公司,中国,山东,济南,,,未找到坐标
648,山东科讯生物芯片技术有限公司,中国,山东,济南,,,未找到坐标
649,山东朝启电子科技有限公司,中国,山东,济南,117.225771,36.677535,
650,山东舒尔智能工程有限公司,中国,山东,济南,,,未找到坐标
651,山东东林环境科技有限公司,中国,山东,济南,,,未找到坐标
652,云科（山东）电子科技有限公司,中国,山东,济南,117.031625,36.679825,
653,山东中测校准质控技术有限公司,中国,山东,济南,117.214981,36.651763,
654,瀚高基础软件股份有限公司,中国,山东,济南,117.142342,36.665541,
655,山东客套智能科技有限公司,中国,山东,济南,,,未找到坐标
656,山东鑫雅特艺纸制品有限公司,中国,山东,济南,117.245110,36.885864,
657,山东国耀量子雷达科技有限公司,中国,山东,济南,,,未找到坐标
658,山东深蓝智谱数字科技有限公司,中国,山东,济南,117.133409,36.668795,
659,山东浪潮智慧能源科技有限公司,中国,山东,济南,117.126824,36.664448,
660,山东中鸿特检生物科技有限公司,中国,山东,济南,,,未找到坐标
661,济南光机医疗设备有限公司,中国,山东,济南,117.120128,36.652069,
662,山东金码信息技术有限公司,中国,山东,济南,,,未找到坐标
663,山东同智信息科技有限公司,中国,山东,济南,,,未找到坐标
664,山东旭研信息科技有限公司,中国,山东,济南,,,未找到坐标
665,山东壹酒叮咚电子技术有限公司,中国,山东,济南,117.031625,36.679825,
666,济南金港热处理有限公司,中国,山东,济南,117.200385,36.791104,
667,山东恒道信息技术有限公司,中国,山东,济南,117.002488,36.662317,
668,山东网聪信息科技有限公司,中国,山东,济南,117.136658,36.677413,
669,山东新睿信息科技有限公司,中国,山东,济南,,,未找到坐标
670,山东乐普韦尔自动化技术有限公司,中国,山东,济南,117.132209,36.673764,
671,山东电工配网科技发展有限公司,中国,山东,济南,,,未找到坐标
672,山东和信智能科技有限公司,中国,山东,济南,,,未找到坐标
673,山东八宇网络科技有限公司,中国,山东,济南,,,未找到坐标
674,华杰恒信（山东）电子科技有限公司,中国,山东,济南,117.031625,36.679825,
675,山东大丁木丰科技信息有限公司,中国,山东,济南,,,未找到坐标
676,山东小鸭新能源科技有限公司,中国,山东,济南,,,未找到坐标
677,山东锋士信息技术有限公司,中国,山东,济南,,,未找到坐标
678,济南鑫捷瑞电气有限公司,中国,山东,济南,117.213117,36.817707,
679,山东小鸭精工机械有限公司,中国,山东,济南,117.138916,36.691796,
680,山东人才信总科技有限公司,中国,山东,济南,,,未找到坐标
681,山东科华电力技术有限公司,中国,山东,济南,,,未找到坐标
682,山东志伟智能制造集团有限公司,中国,山东,济南,,,未找到坐标
683,易通金服支付有限公司,中国,山东,济南,117.140395,36.679090,
684,济南固丰建材科技有限公司,中国,山东,济南,,,未找到坐标
685,山东华健信息科技有限公司,中国,山东,济南,,,未找到坐标
686,山东水发鲁润水务科技有限公司,中国,山东,济南,117.014922,36.687640,
687,山东融谷信息科技有限公司,中国,山东,济南,,,未找到坐标
688,山东久辉信息科技有限公司,中国,山东,济南,,,未找到坐标
689,山东泽众电子科技有限公司,中国,山东,济南,117.031625,36.679825,
690,山东邦维信息科技有限公司,中国,山东,济南,,,未找到坐标
691,山东纳恩信息科技有限公司,中国,山东,济南,,,未找到坐标
692,济南百博生物技术股份有限公司,中国,山东,济南,,,未找到坐标
693,山东电工电气集团智能电气有限公司,中国,山东,济南,,,未找到坐标
694,山东舜辉装饰工程有限公司,中国,山东,济南,,,未找到坐标
695,山东龙羲含章科技发展有限公司,中国,山东,济南,,,未找到坐标
696,山东国稳电气有限公司,中国,山东,济南,,,未找到坐标
697,山东中翰软件有限公司,中国,山东,济南,,,未找到坐标
698,济南唯智光电科技有限公司,中国,山东,济南,117.261116,36.718417,
699,济南格林信息科技有限公司,中国,山东,济南,117.117235,36.680933,
700,金诃藏药(山东)健康产业有限公司,中国,山东,济南,117.341825,36.693637,
701,山东飞博赛斯光电科技有限公司,中国,山东,济南,117.134275,36.678075,
702,济南超然信息科技有限公司,中国,山东,济南,,,未找到坐标
703,山东华云三维科技有限公司,中国,山东,济南,117.149935,36.664751,
704,山东汇达新型建筑材料有限公司,中国,山东,济南,117.010663,36.875622,
705,济南赛诺富隆新材料有限公司,中国,山东,济南,116.997961,36.888347,
706,中道华泰建设集团有限公司,中国,山东,济南,117.222112,36.653540,